[
  {
    "id": "https://lenta.ru/news/2025/12/10/switch/",
    "title": "Переход с iPhone на Android-смартфоны упростили",
    "link": "https://lenta.ru/news/2025/12/10/switch/",
    "source": "lenta.ru",
    "raw_text": "Американские корпорации Apple и Google договорились о создании технологии быстрого обмена данными между iPhone и Android-устройствами. Об этом сообщает профильное издание 9to5Google.\nНовую технологию обнаружили в бета-версии сборки операционной системы (ОС) Android. Специалисты объяснили, что инженеры Apple и Google создали систему, которая позволит быстро переносить данные с iPhone на Android-телефоны и обратно. Это позволит в упрощенном порядке переносить информацию и настройки со старого iPhone на новый телефон с ОС от Google или обратно.\nО подробностях работы нового сервиса ничего не известно. Однако в Google подтвердили, что технология для быстрого переноса, разработанная совместно с Apple, действительно появится в будущих версиях ОС.\nЖурналисты 9to5Google отметили, что Apple и Google традиционно соперничают на рынке ОС и смартфонов и до этого не были склонны отпускать своих пользователей в другие экосистемы. Однако ранее в обеих компаниях были созданы приложения, которые упрощают переход со смартфона на смартфон: Apple был запущен сервис Move to iOS, Google — Android Switch.\nРанее эксперт сотовой связи Игорь Жиленко назвал способы продлить время работы смартфона. Специалист посоветовал держать заряд батареи в диапазоне от 20 до 80 процентов и не допускать перегрева аккумулятора.",
    "body_status": "ok",
    "body_len": 1305,
    "clean_text": "Американские корпорации Apple и Google договорились о создании технологии быстрого обмена данными между iPhone и Android-устройствами. Об этом сообщает профильное издание 9to5Google. Новую технологию обнаружили в бета-версии сборки операционной системы (ОС) Android. Специалисты объяснили, что инженеры Apple и Google создали систему, которая позволит быстро переносить данные с iPhone на Android-телефоны и обратно. Это позволит в упрощенном порядке переносить информацию и настройки со старого iPhone на новый телефон с ОС от Google или обратно. О подробностях работы нового сервиса ничего не известно. Однако в Google подтвердили, что технология для быстрого переноса, разработанная совместно с Apple, действительно появится в будущих версиях ОС. Журналисты 9to5Google отметили, что Apple и Google традиционно соперничают на рынке ОС и смартфонов и до этого не были склонны отпускать своих пользователей в другие экосистемы. Однако ранее в обеих компаниях были созданы приложения, которые упрощают переход со смартфона на смартфон: Apple был запущен сервис Move to iOS, Google — Android Switch. Ранее эксперт сотовой связи Игорь Жиленко назвал способы продлить время работы смартфона. Специалист посоветовал держать заряд батареи в диапазоне от 20 до 80 процентов и не допускать перегрева аккумулятора."
  },
  {
    "id": "https://lenta.ru/news/2025/12/10/glava-iihfnazval-sroki-obsuzhdeniya-vozvrascheniya-sbornoy-rossii-na-mezhdunarodnye-turniry/",
    "title": "Глава IIHF назвал сроки обсуждения возвращения сборной России на международные турниры",
    "link": "https://lenta.ru/news/2025/12/10/glava-iihfnazval-sroki-obsuzhdeniya-vozvrascheniya-sbornoy-rossii-na-mezhdunarodnye-turniry/",
    "source": "lenta.ru",
    "raw_text": "Глава Международной федерации хоккея (IIHF) Люк Тардиф назвал сроки очередного обсуждения возвращения сборной России на турниры под эгидой организации. Об этом сообщает ТАСС .\nПоследнее заседание IIHF, на котором обсуждался этот вопрос, прошло 3 декабря. «Никакого решения тогда вынесено не было. Как обычно, оно будет в конце января или в середине февраля», — сказал Тардиф.\nРанее чемпион Олимпийских игр-2018 по хоккею Богдан Киселевич рассказал об отношении иностранцев к отстранению россиян. «Они говорят, что без нас турниры стали слабее», — заявил игрок.\nРоссийские хоккеисты отстранены от международных турниров с февраля 2022 года. Из-за санкций со стороны IIHF и МОК сборная пропускает все крупные соревнования, включая чемпионаты мира и Олимпиаду.",
    "body_status": "ok",
    "body_len": 757,
    "clean_text": "Глава Международной федерации хоккея (IIHF) Люк Тардиф назвал сроки очередного обсуждения возвращения сборной России на турниры под эгидой организации. Об этом сообщает ТАСС. Последнее заседание IIHF, на котором обсуждался этот вопрос, прошло 3 декабря. «Никакого решения тогда вынесено не было. Как обычно, оно будет в конце января или в середине февраля», — сказал Тардиф. Ранее чемпион Олимпийских игр-2018 по хоккею Богдан Киселевич рассказал об отношении иностранцев к отстранению россиян. «Они говорят, что без нас турниры стали слабее», — заявил игрок. Российские хоккеисты отстранены от международных турниров с февраля 2022 года. Из-за санкций со стороны IIHF и МОК сборная пропускает все крупные соревнования, включая чемпионаты мира и Олимпиаду."
  },
  {
    "id": "https://lenta.ru/news/2025/12/10/peregovory-ssha-i-evropy-po-ukraine-opisali-odnim-slovom/",
    "title": "Переговоры США и Европы по Украине описали одним словом",
    "link": "https://lenta.ru/news/2025/12/10/peregovory-ssha-i-evropy-po-ukraine-opisali-odnim-slovom/",
    "source": "lenta.ru",
    "raw_text": "Переговоры США и Европы по предоставлению гарантий безопасности Украине можно назвать неловкими. Об этом на анонимной основе заявил высокопоставленный представитель министерства обороны одной из европейских стран в беседе с Politico.\nПо словам собеседника издания, обсуждение гарантий безопасности для Киева стало «неловким». Он добавил, что таким же словом можно описать переговоры с США по статье 5 Устава НАТО , которая предполагает защиту со стороны союзников в случае нападения на одну из сторон.\n«Неопределенность в отношении того, как США поведут себя в случае нападения на прифронтовое государство, слишком высока», — заявил чиновник.\nРанее член Конгресса США от Республиканской партии Томас Масси представил законопроект о выходе Соединенных Штатов из НАТО.",
    "body_status": "ok",
    "body_len": 766,
    "clean_text": "Переговоры США и Европы по предоставлению гарантий безопасности Украине можно назвать неловкими. Об этом на анонимной основе заявил высокопоставленный представитель министерства обороны одной из европейских стран в беседе с Politico. По словам собеседника издания, обсуждение гарантий безопасности для Киева стало «неловким». Он добавил, что таким же словом можно описать переговоры с США по статье 5 Устава НАТО, которая предполагает защиту со стороны союзников в случае нападения на одну из сторон. «Неопределенность в отношении того, как США поведут себя в случае нападения на прифронтовое государство, слишком высока», — заявил чиновник. Ранее член Конгресса США от Республиканской партии Томас Масси представил законопроект о выходе Соединенных Штатов из НАТО."
  }
]
